{"activationSetId":"pact_d07b17ef0e339abb","audience":"response_rich_local","bundleId":"pb_89d9518d833b885efecf","bundleSemanticFingerprint":"89d9518d833b885efecf55307e972f904022a386346c3cc53160a1b8b3f08124","configFingerprint":"571fc06c15bffd080681e06a377ce366d6e62626e7f374569fc362803419ebba","dsnEnvironmentVariable":"RETAIL_POSTGRES_DSN","environment":"local","logicalDatabaseTarget":"retail_intelligence","retailerId":"retailer-demo","schemaVersion":"retail-pricing-local-serving-config/v1","tenantId":"tenant-demo"}
